Success,Comment

"(False, 'def __init__(\n    import_name: str,\n    static_url_path: str | None = None,\n    static_folder: str | os.PathLike[str] | None = ""static"",\n    static_host: str | None = None,\n    host_matching: bool = False,\n    subdomain_matching: bool = False,\n    template_folder: str | os.PathLike[str] | None = ""templates"",\n    instance_path: str | None = None,\n    instance_relative_config: bool = False,\n    root_path: str | None = None,\n) -> None:\n    """"""\n    Initializes a new Flask application.\n\n    :param import_name: The name of the module to import.\n    :param static_url_path: The URL path for static files. Defaults to None.\n    :param static_folder: The folder where static files are stored. Defaults to ""static"".\n    :param static_host: The host for static files. Defaults to None.\n    :param host_matching: Whether to match the host in the URL. Defaults to False.\n    :param subdomain_matching: Whether to match subdomains in the URL. Defaults to False.\n    :param template_folder: The folder where templates are stored. Defaults to ""templates"".\n    :param instance_path: The path to the instance folder. Defaults to None.\n    :param instance_relative_config: Whether to load configuration from files relative to the instance folder. Defaults to False.\n    :param root_path: The root path for the application. Defaults to None.\n\n    .. versionadded:: 0.8\n        Added support for loading configuration from files relative to the instance folder.\n\n    .. versionadded:: 2.2\n        Moved the aborter creation to a separate method, allowing for customization.\n    """"""\n    super().__init__(\n        import_name=import_name,\n        static_folder=static_folder,\n        static_url_path=static_url_path,\n        template_folder=template_folder,\n        root_path=root_path,\n    )\n\n    if instance_path is None:\n        instance_path = self.auto_find_instance_path()\n    elif not os.path.isabs(instance_path):\n        raise ValueError(\n            ""If an instance path is provided it must be absolute.""\n            "" A relative path was given instead.""\n        )\n\n    self.instance_path = instance_path\n\n    self.config = self.make_config(instance_relative_config)\n\n    self.aborter = self.make_aborter()\n\n    self.json = self.json_provider_class(self)\n    """"""Provides access to JSON methods. Functions in ``flask.json``\n    will call methods on this provider when the application context\n    is active. Used for handling JSON requests and responses.\n\n    An instance of :attr:`json_provider_class`. Can be customized by\n    changing that attribute on a subclass, or by assigning to this\n    attribute afterwards.\n\n    The default, :class:`~flask.json.provider.DefaultJSONProvider`,\n    uses Python\'s built-in :mod:`json` library. A different provider\n    can use a different JSON library.\n\n    .. versionadded:: 2.2\n    """"""\n\n    self.url_build_error_handlers: list[\n        t.Callable[[Exception, str, dict[str, t.Any]], str]\n    ] = []\n\n    self.teardown_appcontext_funcs: list[ft.TeardownCallable] = []\n\n    self.shell_context_processors: list[ft.ShellContextProcessorCallable] = []\n\n    self.blueprints: dict[str, Blueprint] = {}\n\n    self.extensions: dict[str, t.Any] = {}\n\n    self.url_map = self.url_map_class(host_matching=host_matching)\n\n    self.subdomain_matching = subdomain_matching\n\n    # tracks internally if the application already handled at least one\n    # request.\n    self._got_first_request = False')","(False, ""```\nAdds a URL rule to the application's URL map.\n\nParameters\n----------\nrule : str\n    The URL pattern for the new rule.\nendpoint : str | None, optional\n    The name of the endpoint function. If not provided, it will be automatically generated from the view function.\nview_func : ft.RouteCallable | None, optional\n    The endpoint function to associate with this rule. If not provided, a default endpoint will be created.\nprovide_automatic_options : bool | None, optional\n    Whether to provide automatic options for this rule. If not provided, it will be automatically enabled if the view function has `provide_automatic_options` set or if the application is configured to do so.\noptions : t.Any, optional\n    Additional keyword arguments to pass to the URL rule.\n\nReturns\n-------\nNone\n\nRaises\n------\nTypeError\n    If the methods argument is a string instead of a list of strings.\n```"")"












"(False, 'def __init__(\n    import_name: str,\n    static_url_path: str | None = None,\n    static_folder: str | os.PathLike[str] | None = ""static"",\n    static_host: str | None = None,\n    host_matching: bool = False,\n    subdomain_matching: bool = False,\n    template_folder: str | os.PathLike[str] | None = ""templates"",\n    instance_path: str | None = None,\n    instance_relative_config: bool = False,\n    root_path: str | None = None,\n) -> None:\n    """"""\n    Initializes a new Flask application.\n\n    This method is called when creating a new Flask application. It sets up\n    the basic configuration and initializes the internal state of the\n    application.\n\n    :param import_name: The name of the module to import.\n    :param static_url_path: The URL path for serving static files.\n    :param static_folder: The folder where static files are stored.\n    :param static_host: The host for serving static files.\n    :param host_matching: Whether to match hosts in the URL.\n    :param subdomain_matching: Whether to match subdomains in the URL.\n    :param template_folder: The folder where templates are stored.\n    :param instance_path: The path to the instance folder. If not provided,\n        it will be automatically determined.\n    :param instance_relative_config: Whether to load configuration from\n        files relative to the instance folder.\n    :param root_path: The root path of the application.\n    """"""\n    super().__init__(\n        import_name=import_name,\n        static_folder=static_folder,\n        static_url_path=static_url_path,\n        template_folder=template_folder,\n        root_path=root_path,\n    )\n\n    if instance_path is None:\n        instance_path = self.auto_find_instance_path()\n    elif not os.path.isabs(instance_path):\n        raise ValueError(\n            ""If an instance path is provided it must be absolute.""\n            "" A relative path was given instead.""\n        )\n\n    #: Holds the path to the instance folder.\n    #: \n    #: .. versionadded:: 0.8\n    self.instance_path = instance_path\n\n    #: The configuration dictionary as :class:`Config`.  This behaves\n    #: exactly like a regular dictionary but supports additional methods\n    #: to load a config from files.\n    self.config = self.make_config(instance_relative_config)\n\n    #: An instance of :attr:`aborter_class` created by\n    #: :meth:`make_aborter`. This is called by :func:`flask.abort`\n    #: to raise HTTP errors, and can be called directly as well.\n    #: \n    #: .. versionadded:: 2.2\n    #:     Moved from ``flask.abort``, which calls this object.\n    self.aborter = self.make_aborter()\n\n    self.json: JSONProvider = self.json_provider_class(self)\n    """"""Provides access to JSON methods. Functions in ``flask.json``\n    will call methods on this provider when the application context\n    is active. Used for handling JSON requests and responses.\n\n    An instance of :attr:`json_provider_class`. Can be customized by\n    changing that attribute on a subclass, or by assigning to this\n    attribute afterwards.\n\n    The default, :class:`~flask.json.provider.DefaultJSONProvider`,\n    uses Python\'s built-in :mod:`json` library. A different provider\n    can use a different JSON library.\n\n    .. versionadded:: 2.2\n    """"""\n\n    #: A list of functions that are called by\n    #: :meth:`handle_url_build_error` when :meth:`.url_for` raises a\n    #: :exc:`~werkzeug.routing.BuildError`. Each function is called\n    #: with ``error``, ``endpoint`` and ``values``. If a function\n    #: returns ``None`` or raises a ``BuildError``, it is skipped.\n    #: Otherwise, its return value is returned by ``url_for``.\n    #: \n    #: .. versionadded:: 0.9\n    self.url_build_error_handlers: list[\n        t.Callable[[Exception, str, dict[str, t.Any]], str]\n    ] = []\n\n    #: A list of functions that are called when the application context\n    #: is destroyed.  Since the application context is also torn down\n    #: if the request ends this is the place to store code that disconnects\n    #: from databases.\n    #: \n    #: .. versionadded:: 0.9\n    self.teardown_appcontext_funcs: list[ft.TeardownCallable] = []\n\n    #: A list of shell context processor functions that should be run\n    #: when a shell context is created.\n    #: \n    #: .. versionadded:: 0.11\n    self.shell_context_processors: list[ft.ShellContextProcessorCallable] = []\n\n    #: Maps registered blueprint names to blueprint objects. The\n    #: dict retains the order the blueprints were registered in.\n    #: Blueprints can be registered multiple times, this dict does\n    #: not track how often they were attached.\n    #: \n    #: .. versionadded:: 0.7\n    self.blueprints: dict[str, Blueprint] = {}\n\n    #: a place where extensions can store application specific state.  For\n    #: example this is where an extension could store database engines and\n    #: similar things.\n    #: \n    #: The key must match the name of the extension module. For example in\n    #: case of a ""Flask-Foo"" extension in `flask_foo`, the key would be\n    #: ``\'foo\'``.\n    #: \n    #: .. versionadded:: 0.7\n    self.extensions: dict[str, t.Any] = {}\n\n    #: The :class:`~werkzeug.routing.Map` for this instance.  You can use\n    #: this to change the routing converters after the class was created\n    #: but before any routes are connected.  Example::\n    #:\n    #:    from werkzeug.routing import BaseConverter\n    #:\n    #:    class ListConverter(BaseConverter):\n    #:        def to_python(self, value):\n    #:            return value.split(\',\')\n    #:        def to_url(self, values):\n    #:            return \',\'.join(super(ListConverter, self).to_url(value)\n    #:                            for value in values)\n    #:\n    #:    app = Flask(__name__)\n    #:    app.url_map.converters[\'list\'] = ListConverter\n    self.url_map = self.url_map_class(host_matching=host_matching)\n\n    self.subdomain_matching = subdomain_matching\n\n    # tracks internally if the application already handled at least one\n    # request.\n    self._got_first_request = False')","(False, 'def add_url_rule(\n    rule: str,\n    endpoint: str | None = None,\n    view_func: ft.RouteCallable | None = None,\n    provide_automatic_options: bool | None = None,\n    **options: t.Any,\n) -> None:\n    """"""\n    Adds a URL rule to the application\'s URL map.\n\n    This function is used to register routes for an application. It takes\n    several parameters, including the route rule, endpoint, view function,\n    and options. The endpoint and view function are optional and can be\n    specified if they are already defined elsewhere in the code.\n\n    Args:\n        rule (str): The URL rule to add.\n        endpoint (str | None): The endpoint for this rule. Defaults to None.\n        view_func (ft.RouteCallable | None): The view function for this rule. Defaults to None.\n        provide_automatic_options (bool | None): Whether to automatically\n            include OPTIONS in the route. Defaults to None.\n        **options: t.Any: Additional options for the route.\n\n    Returns:\n        None\n\n    Raises:\n        TypeError: If the methods are not a list of strings.\n        AssertionError: If the view function mapping is overwriting an existing endpoint function.\n    """"""')"


"(True, '""""""\nReturns an iterator that yields values from a given generator or function, \nwith context information (i.e., the current frame and line number). \n\nArgs:\n    generator_or_function: An iterator that produces strings.\n\nYields:\n    The next string produced by the input iterator.\n""""""')","(True, '""""""\nReturns a function that takes an iterator as input and returns an iterator over the same values, \nwith the ability to iterate over the original sequence again using the `next()` function. \n\nThis is achieved by creating a context manager that yields control back to the caller after each iteration.\n\nArgs:\n    generator_or_function: A callable that returns an iterator. This can be either a generator expression or a function.\n\nReturns:\n    A new function that takes an iterator as input and returns an iterator over the same values.\n""""""')","(False, 'def stream_with_context(\n    """"""\n    A context manager for streaming data from a generator or function.\n\n    This decorator can be used to create a context manager that streams data\n    from a generator or function. It uses the context manager protocol to push\n    and pop a request context, which is typically used in web frameworks like\n    Django or Flask.\n\n    Args:\n        generator_or_function: A generator or function that yields strings.\n            If it\'s a generator, it will be wrapped in a context manager. If it\'s\n            a function, it will be called with the provided arguments and then\n            wrapped in a context manager.\n\n    Returns:\n        An iterator over the streamed data, or a decorator function if the input\n        is not a generator.\n    """"""\n    generator_or_function: t.Iterator[t.AnyStr] | t.Callable[..., t.Iterator[t.AnyStr]]\n) -> t.Iterator[t.AnyStr] | t.Callable[[t.Iterator[t.AnyStr]], t.Iterator[t.AnyStr]]:\n    try:\n        gen = iter(generator_or_function)  # type: ignore[arg-type]\n    except TypeError:\n\n        def decorator(*args: t.Any, **kwargs: t.Any) -> t.Any:\n            """"""\n            A decorator that wraps the input generator or function in a context\n            manager.\n            """"""\n            gen = generator_or_function(*args, **kwargs)  # type: ignore[operator]\n            return stream_with_context(gen)\n\n        return update_wrapper(decorator, generator_or_function)  # type: ignore[arg-type]\n\n    def generator() -> t.Iterator[t.AnyStr | None]:\n        """"""\n        The inner generator that streams data from the input generator or function.\n        """"""\n        ctx = _cv_request.get(None)\n        if ctx is None:\n            raise RuntimeError(\n                ""\'stream_with_context\' can only be used when a request""\n                "" context is active, such as in a view function.""\n            )\n        with ctx:\n            # Dummy sentinel.  Has to be inside the context block or we\'re\n            # not actually keeping the context around.\n            yield None\n\n            # The try/finally is here so that if someone passes a WSGI level\n            # iterator in we\'re still running the cleanup logic.  Generators\n            # don\'t need that because they are closed on their destruction\n            # automatically.\n            try:\n                yield from gen\n            finally:\n                if hasattr(gen, ""close""):\n                    gen.close()\n\n    # The trick is to start the generator.  Then the code execution runs until\n    # the first dummy None is yielded at which point the context was already\n    # pushed.  This item is discarded.  Then when the iteration continues the\n    # real generator is executed.\n    wrapped_g = generator()\n    next(wrapped_g)\n    return wrapped_g  # type: ignore[return-value]')","(True, '""""""\nConverts an object to a format suitable for JSON serialization.\n\nThis function checks the type of the input object and converts it accordingly:\n- If the object is a date, it returns its HTTP representation.\n- If the object is a decimal.Decimal or uuid.UUID, it returns its string representation.\n- If the object is a dataclass instance, it returns its dictionary representation.\n- If the object has an __html__ method, it returns its HTML representation.\n\nIf none of these conversions are possible, it raises a TypeError with a message indicating the type of the input object.\n\nArgs:\n    o: The object to be converted\n\nReturns:\n    A string representation of the object in JSON format\nRaises:\n    TypeError: If the object is not JSON serializable\n""""""')"
"(False, 'def stream_with_context(\n    """"""\n    A context manager for streaming data from a generator or function.\n\n    This decorator can be used to create a context manager that streams data\n    from a generator or function. It uses the context manager protocol to push\n    and pop a request context, which is typically used in web frameworks like\n    Django or Flask.\n\n    Args:\n        generator_or_function: A generator or function that yields strings.\n            If it\'s a generator, it will be wrapped in a context manager. If it\'s\n            a function, it will be called with the provided arguments and then\n            wrapped in a context manager.\n\n    Returns:\n        An iterator over the streamed data, or a decorator function if the input\n        is not a generator.\n    """"""\n    generator_or_function: t.Iterator[t.AnyStr] | t.Callable[..., t.Iterator[t.AnyStr]]\n) -> t.Iterator[t.AnyStr] | t.Callable[[t.Iterator[t.AnyStr]], t.Iterator[t.AnyStr]]:\n    try:\n        gen = iter(generator_or_function)  # type: ignore[arg-type]\n    except TypeError:\n\n        def decorator(*args: t.Any, **kwargs: t.Any) -> t.Any:\n            """"""\n            A decorator that wraps the input generator or function in a context\n            manager.\n            """"""\n            gen = generator_or_function(*args, **kwargs)  # type: ignore[operator]\n            return stream_with_context(gen)\n\n        return update_wrapper(decorator, generator_or_function)  # type: ignore[arg-type]\n\n    def generator() -> t.Iterator[t.AnyStr | None]:\n        """"""\n        The inner generator that streams data from the input generator or function.\n        """"""\n        ctx = _cv_request.get(None)\n        if ctx is None:\n            raise RuntimeError(\n                ""\'stream_with_context\' can only be used when a request""\n                "" context is active, such as in a view function.""\n            )\n        with ctx:\n            # Dummy sentinel.  Has to be inside the context block or we\'re\n            # not actually keeping the context around.\n            yield None\n\n            # The try/finally is here so that if someone passes a WSGI level\n            # iterator in we\'re still running the cleanup logic.  Generators\n            # don\'t need that because they are closed on their destruction\n            # automatically.\n            try:\n                yield from gen\n            finally:\n                if hasattr(gen, ""close""):\n                    gen.close()\n\n    # The trick is to start the generator.  Then the code execution runs until\n    # the first dummy None is yielded at which point the context was already\n    # pushed.  This item is discarded.  Then when the iteration continues the\n    # real generator is executed.\n    wrapped_g = generator()\n    next(wrapped_g)\n    return wrapped_g  # type: ignore[return-value]')"
"(True, '""""""\nStream a generator or function with context.\n\nThis function takes an iterator or callable that returns an iterator, and wraps it in a context manager. The context manager pushes the current request context onto the stack when the generator is started, and pops it off when the iteration completes.\n\nIf the input is not a generator or function, but rather a decorator factory, this function will create a new decorator that takes arguments and keyword arguments, calls the original function with those arguments, and then wraps the result in another context manager.\n\nThe `stream_with_context` function can only be used when a request context is active, such as in a view function. If no request context is available, it raises a RuntimeError.\n\nReturns:\n    An iterator that yields the same values as the original generator or function, but with the added benefit of being able to use the current request context.\n    A callable that takes an iterator and returns an iterator, if the input was not a generator or function.\n""""""')","(False, ""```\nAdds a URL rule to the application's URL map.\n\nParameters\n----------\nrule : str\n    The URL pattern for the new rule.\nendpoint : str | None, optional\n    The name of the endpoint function. If not provided, it will be automatically generated from the view function.\nview_func : ft.RouteCallable | None, optional\n    The endpoint function to associate with this rule. If not provided, a default endpoint will be created.\nprovide_automatic_options : bool | None, optional\n    Whether to provide automatic options for this rule. If not provided, it will be automatically enabled if the view function has `provide_automatic_options` set or if the application is configured to do so.\noptions : t.Any, optional\n    Additional keyword arguments to pass to the URL rule.\n\nReturns\n-------\nNone\n\nRaises\n------\nTypeError\n    If the methods argument is a string instead of a list of strings.\n```"")"
"(False, '""""""\nStream a generator or function with context.\n\nThis function takes an iterator or callable that returns an iterator, and wraps it in a context manager. The context manager pushes the current request context onto the stack when the generator is started, and pops it off when the iteration completes.\n\nIf the input is not a generator or function, but rather a decorator factory, this function will create a new decorator that takes arguments and keyword arguments, calls the original function with those arguments, and then wraps the result in another context manager.\n\nThe `stream_with_context` function can only be used when a request context is active, such as in a view function. If no request context is available, it raises a RuntimeError.\n\nReturns:\n    An iterator that yields the same values as the original generator or function, but with the added benefit of being able to use the current request context.\n    A callable that takes an iterator and returns an iterator, if the input was not a generator or function.')","(False, 'def add_url_rule(\n    rule: str,\n    endpoint: str | None = None,\n    view_func: ft.RouteCallable | None = None,\n    provide_automatic_options: bool | None = None,\n    **options: t.Any,\n) -> None:\n    """"""\n    Adds a URL rule to the application\'s URL map.\n\n    This function is used to register routes for an application. It takes\n    several parameters, including the route rule, endpoint, view function,\n    and options. The endpoint and view function are optional and can be\n    specified if they are already defined elsewhere in the code.\n\n    Args:\n        rule (str): The URL rule to add.\n        endpoint (str | None): The endpoint for this rule. Defaults to None.\n        view_func (ft.RouteCallable | None): The view function for this rule. Defaults to None.\n        provide_automatic_options (bool | None): Whether to automatically\n            include OPTIONS in the route. Defaults to None.\n        **options: t.Any: Additional options for the route.\n\n    Returns:\n        None\n\n    Raises:\n        TypeError: If the methods are not a list of strings.\n        AssertionError: If the view function mapping is overwriting an existing endpoint function.\n    """"""')"
"(False, '""""""\nStream a generator or function with context.\n\nThis function takes an iterator or callable that returns an iterator, and wraps it in a context manager. The context manager pushes the current request context onto the stack when the generator is started, and pops it off when the iteration completes.\n\nIf the input is not a generator or function, but rather a decorator factory, this function will create a new decorator that takes arguments and keyword arguments, calls the original function with those arguments, and then wraps the result in another context manager.\n\nThe `stream_with_context` function can only be used when a request context is active, such as in a view function. If no request context is available, it raises a RuntimeError.\n\nReturns:\n    An iterator that yields the same values as the original generator or function, but with the added benefit of being able to use the current request context.\n    A callable that takes an iterator and returns an iterator, if the input was not a generator or function.')","(False, ""```\nAdds a URL rule to the application's URL map.\n\nParameters\n----------\nrule : str\n    The URL pattern for the new rule.\nendpoint : str | None, optional\n    The name of the endpoint function. If not provided, it will be automatically generated from the view function.\nview_func : ft.RouteCallable | None, optional\n    The endpoint function to associate with this rule. If not provided, a default endpoint will be created.\nprovide_automatic_options : bool | None, optional\n    Whether to provide automatic options for this rule. If not provided, it will be automatically enabled if the view function has `provide_automatic_options` set or if the application is configured to do so.\noptions : t.Any, optional\n    Additional keyword arguments to pass to the URL rule.\n\nReturns\n-------\nNone\n\nRaises\n------\nTypeError\n    If the methods argument is a string instead of a list of strings.\n```"")"
